{
  "$schema": "https://json-schema.org/draft/2020-12/schema",
  "$defs": {
    "StructureFileAny": {
      "additionalProperties": false,
      "description": "An outline entry matching a run, of any length, of sections the outline does not name.\n\nThe run stops at any section the outline names, so each named section still matches its own entry.",
      "examples": [
        {
          "any": true
        },
        {
          "any": true,
          "words": 350
        }
      ],
      "properties": {
        "any": {
          "const": true,
          "description": "Always true: the field that marks the entry as a run.",
          "type": "boolean"
        },
        "words": {
          "anyOf": [
            {
              "minimum": 1,
              "type": "integer"
            },
            {
              "type": "null"
            }
          ],
          "default": null,
          "description": "The most words of prose each section in the run may hold, its H3 subsections included: a cap on every section alone, not on the run's total. No cap when absent.",
          "examples": [
            350
          ]
        }
      },
      "required": [
        "any"
      ],
      "title": "Unnamed sections",
      "type": "object"
    },
    "StructureFileSection": {
      "additionalProperties": false,
      "description": "An outline entry naming one section, fixing its position against every other name in the outline.\n\nIts `description` and `examples` tell the author of a document that lacks the section what to write there.",
      "examples": [
        {
          "section": "Checklist",
          "words": 250
        },
        {
          "optional": true,
          "section": "References"
        },
        {
          "description": "The items a reviewer verifies before committing a change the document governs.",
          "examples": [
            "Before committing code, verify:\n\n- [ ] Every new record is a `@dataclass` unless it decodes data arriving from outside the process\n- [ ] Every list, dict, or set default uses `field(default_factory=...)`\n- [ ] Every record used as a dict key, set member, or compared identity is `frozen=True`\n- [ ] Every record's class docstring lists all public fields under `Attributes:`"
          ],
          "section": "Checklist",
          "words": 250
        }
      ],
      "properties": {
        "section": {
          "description": "The section's heading text, without its `#` markers or inline markup.",
          "examples": [
            "Checklist",
            "References"
          ],
          "minLength": 1,
          "pattern": "^\\S(.*\\S)?$",
          "type": "string"
        },
        "optional": {
          "default": false,
          "description": "True when a document may leave the section out.",
          "type": "boolean"
        },
        "words": {
          "anyOf": [
            {
              "minimum": 1,
              "type": "integer"
            },
            {
              "type": "null"
            }
          ],
          "default": null,
          "description": "The most words of prose the section may hold, its H3 subsections included; no cap when absent.",
          "examples": [
            250
          ]
        },
        "description": {
          "anyOf": [
            {
              "minLength": 1,
              "type": "string"
            },
            {
              "type": "null"
            }
          ],
          "default": null,
          "description": "What the section holds; reported as help when a document lacks the section. No help when absent.",
          "examples": [
            "The items a reviewer verifies before committing a change the document governs."
          ]
        },
        "examples": {
          "anyOf": [
            {
              "items": {
                "minLength": 1,
                "type": "string"
              },
              "minItems": 1,
              "type": "array"
            },
            {
              "type": "null"
            }
          ],
          "default": null,
          "description": "A non-empty list of Markdown samples of the section's body, each without its heading. Each is illustrative, written as if it belonged to an actual document of the corpus, not a placeholder. The check reports only the first, as a note, when a document lacks the section; the rest serve a reader of the specification. No sample when absent.",
          "examples": [
            [
              "Before committing code, verify:\n\n- [ ] Every new record is a `@dataclass` unless it decodes data arriving from outside the process\n- [ ] Every list, dict, or set default uses `field(default_factory=...)`\n- [ ] Every record used as a dict key, set member, or compared identity is `frozen=True`\n- [ ] Every record's class docstring lists all public fields under `Attributes:`"
            ]
          ]
        }
      },
      "required": [
        "section"
      ],
      "title": "Named section",
      "type": "object"
    },
    "StructureFileTitle": {
      "additionalProperties": false,
      "description": "The checks a document's H1 title is held to beyond being there, once, opening the document.\n\nEach check is optional, but the key holds at least one: a `title` stating none would check nothing.",
      "examples": [
        {
          "words": 8
        },
        {
          "chars": 60
        },
        {
          "pattern": "^[A-Z]"
        }
      ],
      "minProperties": 1,
      "properties": {
        "words": {
          "anyOf": [
            {
              "minimum": 1,
              "type": "integer"
            },
            {
              "type": "null"
            }
          ],
          "default": null,
          "description": "The most words the title's text may hold, counted as a section's prose words are; no cap when absent.",
          "examples": [
            8
          ]
        },
        "chars": {
          "anyOf": [
            {
              "minimum": 1,
              "type": "integer"
            },
            {
              "type": "null"
            }
          ],
          "default": null,
          "description": "The most characters the title's text may hold, inline markup stripped, counted as Unicode code points; no cap when absent.",
          "examples": [
            60
          ]
        },
        "pattern": {
          "anyOf": [
            {
              "minLength": 1,
              "type": "string"
            },
            {
              "type": "null"
            }
          ],
          "default": null,
          "description": "A regular expression the title's text must match, searched for anywhere in it as JSON Schema's `pattern` is; any text when absent. An empty one, which every title matches, and one that does not compile are refused when the file loads.",
          "examples": [
            "^[A-Z]",
            "^[^:]+$"
          ]
        }
      },
      "title": "Title checks",
      "type": "object"
    }
  },
  "additionalProperties": false,
  "description": "A structure specification: the frontmatter schema, outline and token budget a governed document follows.",
  "examples": [
    {
      "description": "Section structure, word caps and token budget for a rule document in docs/code/.",
      "empty_sections": "forbidden",
      "frontmatter": {
        "additionalProperties": false,
        "properties": {
          "name": {
            "type": "string"
          },
          "description": {
            "type": "string"
          }
        },
        "required": [
          "name",
          "description"
        ],
        "type": "object"
      },
      "lines": 500,
      "outline": [
        {
          "any": true,
          "words": 350
        },
        {
          "section": "Checklist",
          "words": 250
        },
        {
          "optional": true,
          "section": "References"
        },
        {
          "optional": true,
          "section": "External References"
        }
      ],
      "tokens": 5000
    }
  ],
  "properties": {
    "$schema": {
      "anyOf": [
        {
          "type": "string"
        },
        {
          "type": "null"
        }
      ],
      "default": null,
      "description": "The JSON Schema this file is written against, for editors; ignored by the check."
    },
    "description": {
      "default": "",
      "description": "What this file governs and why, for whoever opens it; not read by the check.",
      "examples": [
        "Section structure, word caps and token budget for a rule document in docs/code/."
      ],
      "type": "string"
    },
    "title": {
      "anyOf": [
        {
          "$ref": "#/$defs/StructureFileTitle"
        },
        {
          "type": "null"
        }
      ],
      "default": null,
      "description": "The checks a document's H1 title is held to: `words` caps its words, `chars` its characters, and `pattern` holds its text to a regular expression. No title check when absent; the title is there, once, opening the document, either way."
    },
    "tokens": {
      "anyOf": [
        {
          "minimum": 1,
          "type": "integer"
        },
        {
          "type": "null"
        }
      ],
      "default": null,
      "description": "The token budget: the most tokens the whole file may cost an agent that loads it, frontmatter, code and tables included; no budget when absent. Counted with OpenAI's `o200k_base` encoding, the same whichever agent reads the document.",
      "examples": [
        5000
      ]
    },
    "lines": {
      "anyOf": [
        {
          "minimum": 1,
          "type": "integer"
        },
        {
          "type": "null"
        }
      ],
      "default": null,
      "description": "The line budget for the whole file, frontmatter, code and blank lines included; no budget when absent.",
      "examples": [
        500
      ]
    },
    "frontmatter": {
      "allOf": [
        {
          "$ref": "https://json-schema.org/draft/2020-12/schema"
        },
        {
          "properties": {
            "type": {
              "const": "object"
            }
          },
          "required": [
            "type"
          ],
          "type": "object"
        }
      ],
      "default": null,
      "description": "The Draft 2020-12 JSON Schema a document's frontmatter must satisfy; no frontmatter rule when absent. Its root must state `\"type\": \"object\"`, and it may carry neither `$id` nor a `$schema` naming another dialect.",
      "examples": [
        {
          "additionalProperties": false,
          "properties": {
            "name": {
              "type": "string"
            },
            "description": {
              "type": "string"
            }
          },
          "required": [
            "name",
            "description"
          ],
          "type": "object"
        }
      ]
    },
    "empty_sections": {
      "anyOf": [
        {
          "const": "forbidden",
          "type": "string"
        },
        {
          "type": "null"
        }
      ],
      "default": null,
      "description": "`forbidden` reports every section left without content: one that ends the document, or is followed straight away by a heading of its own level or higher. Empty sections are allowed when absent."
    },
    "outline": {
      "default": [],
      "description": "The order of the document's sections, matched left to right. A named section is required unless optional, and may be named once; an `{\"any\": true}` entry matches a run of sections the outline does not name, and two may not sit side by side. An entry's `words` caps each section it matches; an entry without one caps none. A word is a whitespace-delimited token of prose: fenced code and table rows are not counted. A named section's `description` and the first of its `examples` tell the author of a document that lacks it what to write there.",
      "examples": [
        [
          {
            "any": true,
            "words": 350
          },
          {
            "section": "Checklist",
            "words": 250
          },
          {
            "optional": true,
            "section": "References"
          },
          {
            "optional": true,
            "section": "External References"
          }
        ]
      ],
      "items": {
        "anyOf": [
          {
            "$ref": "#/$defs/StructureFileSection"
          },
          {
            "$ref": "#/$defs/StructureFileAny"
          }
        ]
      },
      "type": "array"
    },
    "forbidden": {
      "default": [],
      "description": "Sections that must not appear at all; none may also be named in the outline.",
      "examples": [
        [
          "Changelog"
        ]
      ],
      "items": {
        "minLength": 1,
        "pattern": "^\\S(.*\\S)?$",
        "type": "string"
      },
      "type": "array",
      "uniqueItems": true
    }
  },
  "title": "Structure specification",
  "type": "object"
}
